,text,여성/가족,남성,성소수자,인종/국적,연령,지역,종교,기타 혐오,악플/욕설,clean
13,이재명은 윤석열 안철수 심상정과 싸웠다 잘했다 극좌와 극우는 통한다고 굿짐당과 정의당 일베와 꼴페미는 같은 편임이 드러났다 민주당은 양성평등을 지향한다면서 청년을 분열시키고 남녀혐오를 조장하는 페미양아치와 결별하고 2030 남녀가 토론하고 협력하는 올바른 페미를 지향하여야 한다,0.91,0.01,0.02,0.04,0.02,0.03,0.02,0.1,0.05,0.1
19,허경영냅두고 왜 심상정팸 안철수냅두고 왜 심상정팸 맨날 여권여권거리는 친구들 결국 지들이 앞장서서 여자패고있음,0.76,0.02,0.01,0.04,0.02,0.02,0.01,0.08,0.22,0.06
133,씻는데 계속 한숨나옴 지금도 나옴 대체 공약도 없고 아는것도 없어서 안철수가 고개저을정도고 심상정후보님한테는 반말 찍찍 싸면서 여자 개차반으로 생각하는 사람이 어케 대통령을 하지,0.7,0.01,0.01,0.03,0.01,0.01,0.01,0.04,0.18,0.14
379,윤석열 제20대 대통령 당선으로 바뀔 것들 여가부 폐지 안철수 총리 미지수 확실한 건 한반도 안보의 위험 그리고 앞으로 적은 임금을 받으면서 더 많은 일해야 하는 건 당연한 수순이 될 것 윤석열 대통령,0.79,0.01,0.02,0.05,0.01,0.02,0.01,0.07,0.06,0.18
513,트렌드 윤석열 대통령 취임일과 지방선거 안철수 인수위에서 여가부폐지 나올까,0.82,0.01,0.02,0.04,0.01,0.02,0.01,0.04,0.05,0.21
1028,이준석 이낙연파 세금낮춰줘빌런 페미가싫은혐오자 성매매합법화지지자 뭣모르는이대남 안철수 등 여러 요인들 대상으로 모두 수고하셨습니다 저희 잘한걸거예요,0.74,0.05,0.02,0.02,0.02,0.02,0.0,0.07,0.09,0.16
1137,빌런을 올린 공훈은 언론 완주 손가락 운운하다 먼저 제안해 단일화한 안철수 여니아니면여리 2번 찍고 여론 선동 열심이던 이니 여니 지지자들 사전투표 관리 엉망 선관위 남녀 갈라치기 2번남 수령 이준석 의외로 별 효과 없었 커뮤니티들은 이미 온갖 남탓 페미탓 정의당탓으로 지옥,0.63,0.01,0.01,0.02,0.01,0.03,0.01,0.07,0.2,0.19
1441,심상정보다 안철수 단일화가 다 컸다고 말하는 빡대가리년들아 그냥 심상정 뽑은거 후회한다고 대놓고 쳐말해 왜 남탓하고 지랄이야 안철수 단일화한건 득 실 전부 아니고 무의미한 표갈림이야 미친년들아 안철수 핑계대지마 니들이 심상정 뽑아서 윤석열 된거야 ㅋㅋ,0.77,0.01,0.01,0.03,0.02,0.02,0.01,0.07,0.27,0.04
1636,2030여성표가 누구 때문에1번에게 몰려갔지만 2번이 돼도 안철수가 N번방과 여성부 문제 원만하게 잘 해결할 것,0.62,0.01,0.01,0.02,0.01,0.01,0.01,0.04,0.1,0.42
1949,국힘은 치밀함이 부족해페미니즘은 세계흐름이니 가지고 가도록거꾸로가는 이미지를 주면 안됨요부디 꼼꼼한 안철수랑 소통하고 화합해서 앞으로 나아가야 반쪽난 나라 통합하고 민심 달랠수 있움,0.7,0.02,0.02,0.02,0.01,0.01,0.01,0.03,0.05,0.29
1976,지금 국힘 지지자들 3가지로 나뉘네1 여자들 탓이다 젠더갈등 2 호남 탓이다 지역갈등 3 안철수 탓이다 소수당갈등 180석때도 정신 못차렸냐 갈등해결은 커녕 어설프게 이용하거나 아예 탓으로 돌리는데 압도적으로 이길거라고 생각했어,0.67,0.02,0.01,0.01,0.01,0.1,0.01,0.05,0.09,0.17
2004,근데 내주변 앵간한 남자들은 다 1번 뽑던데 안철수 뽑으려다 못뽑은애들은 봤어도 2번 지지하는사람 딱 한명봄근데 걔는 사유가 남성인권을 신경써주겠다도 아니고 고작 여성부없애겠다고해서 페미들 꼴좋다고 윤 뽑겠대 ㅋㅋㅋㅋ 물론 가까운 지인 절대아님,0.87,0.02,0.01,0.03,0.01,0.02,0.01,0.04,0.05,0.08
2272,제발꺼졌음좋겠어 페미니즘차치하고서라도 안철수한테개짓한거진짜꼬움,0.84,0.01,0.02,0.04,0.01,0.02,0.02,0.05,0.18,0.06
2690,안철수 대표가 거기 간다고 하더라도 이준석 혐오하는 여자들 도저히 거기 표 못 줬을 거 같다 그 분들 이준석이를 인간취급도 안하던데,0.6,0.01,0.01,0.02,0.01,0.02,0.01,0.06,0.27,0.17
3300,여가부 폐지 신남성연대 지지 등과 더불어 여러가지 멍청한 발언들로 인해 윤은 진짜 안되겠다 생각했고 거기서 윤석열 지지를 멈추고 안철수로 갈아탔음 주변 친구들한테도 안철수 뽑으라고 윤석열 멍청하고 이재명 극혐이라고 많이 이야기를 했었음 얼마전에 안철수가 사퇴하고 나서,0.62,0.01,0.02,0.04,0.01,0.02,0.01,0.07,0.09,0.25
7593,정말 잘 하셨습니다 수차례의 철수는 성공으로 인도합니다,0.67,0.04,0.01,0.03,0.01,0.01,0.0,0.02,0.14,0.23
7845,안철수 배알도 없냐 이제 끝이다 존나 남자 자식이 못나게,0.74,0.02,0.01,0.03,0.12,0.04,0.01,0.1,0.05,0.12
7925,맘 정했음난 안철수 윤석열 에게 투표하기로함그가 진행하는 정치의길에 힘을 실어주기로함 막산이되는꼴도 보기싫고 안철수후보님 힘내고 거침없이 나아가세요현실적인 정치참여와 동시에 지지자들의 이해를 얻는 노력도 아끼지 마시길,0.64,0.02,0.01,0.03,0.01,0.03,0.02,0.21,0.2,0.07
8661,어 근데 어제 사전 투표에 안철수 사퇴 안 찍혀있던데,0.68,0.03,0.01,0.02,0.01,0.01,0.01,0.04,0.12,0.24
9017,1년후에 너님도 안철수와 함께 손가락을,0.85,0.01,0.01,0.05,0.01,0.02,0.01,0.04,0.07,0.14
9618,심상정 지지 국민들은 얘국자입니다 심상정에게 투표하는것은 윤석열이 당선 시키는것입니다 검찰쿠테타 안철수 야합 힘합쳐서 막자고요 5공겪은 노동자입니다 금테는 어려운 국민들에 모르지요 어렵게 살아본 이재명은 알지요 5공겪은사람으로서 이당저당 당원은아니지만요 검찰쿠테타 안철수 야합,0.64,0.05,0.01,0.03,0.01,0.02,0.0,0.02,0.09,0.26
9908,안철수가 과연 윤석열을 정책적으로 얼마나 컨트롤 할 지 궁금 그리고 공은 결국 윤석열이 챙겨가는 것인데 여기에서 안철수가 자신 덕에 정부의 업적이 생겼다는 점을 어떻게 어필할 지도 궁금,0.74,0.01,0.02,0.02,0.01,0.02,0.01,0.03,0.04,0.35
11339,오늘 안철수를 대신해서 말한 그 변을 들어보니 참 끼리끼리 잘 논다 싶을 뿐 이다 부끄러움도 없다 당연 정치윤리란 걸 가져본적도 없었다는 소리인거다 그래도 이럴거라곤 생각도 못했었는데,0.64,0.05,0.02,0.03,0.01,0.01,0.01,0.03,0.16,0.1
14451,ㅋㅋㅋㅋㅋㅋ맞아 울엄마 안철수 뽑을라했는데 갑자기 사퇴하고 윤석열한테 붙었다고 누구 뽑아야될지 모르겠다함ㅋㅋㅋㅋ 아니 대선 며칠남았다고 그러는거임,0.7,0.01,0.02,0.07,0.01,0.01,0.01,0.07,0.15,0.12
15117,윤석열 뽑으면 손가락 짜르고 싶을 것이라던 안철수가 윤석열 밑으로 겨 들어갔다 요 쥐새끼 ㅋㅋ,0.79,0.08,0.04,0.02,0.02,0.01,0.01,0.05,0.09,0.06
16145,틀렷어 안철수 단일화보다 이준석 손절을 했어야 됏음,0.82,0.01,0.02,0.04,0.01,0.08,0.01,0.18,0.11,0.07
17341,윤석열이랑 단일화 한다는 안철수 1년만 지나면 자신의 손가락을 자르겠구나,0.75,0.01,0.02,0.04,0.01,0.02,0.01,0.07,0.1,0.22
17411,YTN 윤석열 안철수 단일화 전격 합의 오전 공동 기자회견 발행일시 2022 03 03 07 03 뉴스 최신뉴스,0.75,0.02,0.01,0.02,0.01,0.04,0.01,0.03,0.16,0.1
18380,아 잠 안 와서 이것저것 보는 중에 안철수 ㅋㅋㅋ 하저새끼는진짜왜맨날이지랄인거임,0.82,0.05,0.01,0.02,0.02,0.03,0.01,0.03,0.15,0.07
18959,내가 투표하는 후보가 선출된다는 믿음으로 선거운동하고 투표하고 결과는 기다릴 일이다 안철수씨 말을 믿는 게 아니었을 뿐,0.86,0.13,0.01,0.04,0.01,0.02,0.02,0.03,0.05,0.03
19354,이재명 찌라시 묻는 윤석열에게 안철수의 간결 답변 난 몰라 내가 수사권 있는 것도 아니고 출처,0.8,0.02,0.02,0.01,0.01,0.01,0.01,0.06,0.14,0.11
19389,안철수 발언에 훌륭 나도 똑같은 생각 좋은 방안 TV토론,0.61,0.12,0.01,0.01,0.03,0.01,0.01,0.06,0.14,0.05
19468,안철수 정말 자랑스러운 내 후보 살면서 나 아닌 누군가를 이렇게 간절히 또 열렬히 응원한 적이 없다 아마도 나는 안철수를 응원했다기보다 내 신념을 응원한 게 아닐까이 지긋지긋한 세상에서 한번쯤은 아름다운 사람이 승리하는 모습을 보고 싶었던 게 아닐까,0.69,0.02,0.01,0.03,0.01,0.01,0.01,0.03,0.09,0.17
19523,뭐가 문제지 안철수가 저번부터 토론을 못해서 윤석열도 상대적으로 덜 문제적이어 보이는 게 문젠가 하 하여튼간에 돌아버리겠음,0.93,0.02,0.02,0.13,0.02,0.02,0.02,0.05,0.04,0.09
19528,토론 보면서 재미있는건이재명 안철수 심상정이 짜고서아주 대놓고 윤석열 집중공격하는데윤석열 맷집 좋게 받아 넘긴다 이재명 얼굴 벌겋게 달아 올랐다 ㅎㅎㅎ,0.83,0.01,0.02,0.23,0.01,0.02,0.01,0.06,0.07,0.15
19531,안철수 정치인으로선 존재감 없는데 교수모드 나오니까 웃수저네 ㅋㅋㅋㅋㅋㅋㅋㅋㅋㅋㅋㅋ,0.68,0.01,0.02,0.05,0.01,0.01,0.01,0.05,0.08,0.35
19941,3월 1주차 주중 차기 대선 후보 지지도 안철수 지지층 흡수하며 윤석열과 이재명 동반 상승 출처 먼곳으로 블로그,0.91,0.01,0.02,0.07,0.02,0.02,0.03,0.08,0.06,0.14
21176,또 속을까 겁나긴 합니다 그러나 이미 안철수에도 속은 인생 문파들한테 왜 못 속아 주나 상식과 원칙으로 돌아온 문파들을 환영합니다,0.71,0.01,0.01,0.03,0.01,0.02,0.01,0.07,0.2,0.12
21262,이상돈 국힘 안철수 수렁 빠질 뻔 잘 아는 이준석이 제동 출처 동아일보 네이버 뉴스 안철수의 리더쉽에 문제가 있다는건 안철수가 정치를 시작하기전 안랩시절부터 논란이 있었죠 주식시장에서 소문이 돌기도 했죠 되는 것도 없고 안되는 것도 없고,0.87,0.02,0.02,0.02,0.06,0.02,0.01,0.15,0.08,0.13
21414,안철수 정치적 기반 무너진다 여론조사 심각 출처,0.81,0.02,0.03,0.01,0.01,0.01,0.01,0.04,0.08,0.17
21732,양다리로 사익추구하는 안철수국민의 유권자 단일화를 통해이번에 완전히 정치생명 끊어야,0.82,0.02,0.01,0.03,0.05,0.05,0.01,0.06,0.07,0.12
22632,내가얘기해주지 안철수는 보수에게실망한지지자들이 불러냈다 지금의안철수는뭐냐 오로지나는손해보지않는다는겨산이깔려있다,0.82,0.02,0.02,0.03,0.01,0.01,0.01,0.04,0.07,0.23
22691,안철수 X파일,0.8,0.01,0.02,0.04,0.01,0.03,0.02,0.07,0.07,0.19
23471,국토마라톤 당시 현장에서 응원의 인터뷰를 기억하시는지요 내딛는 한걸음 한걸음이 이나라 정치를 개혁하는 초석이 될거니 힘내시라는 DJ도 온갖 고난과 시련에 굴복하지 않고 끝까지 정치적 신념을 지켜 대통령에 당선된것을 기억하시고 절대 흔들리지 마시고 최선을 다 하시길 응원합니다,0.83,0.01,0.01,0.22,0.02,0.07,0.03,0.14,0.09,0.02
24599,ㅇㅅㅇ 지지율 떨어지고 있는 거 확실한데 혹시 막산이에게 지면 안철수 탓 글고 나중엔 부정선거 탓하겠지 내가볼땐 50은 자기 부족함 탓 나머지 50은 준서기 탓 586 민주당 정권 욕하느라 국힘쪽 좀 기울었었는데 아무리봐도 상종 못할 조직들 아무리봐도 구리다 철학도 없고 생각도 없는 후보,0.77,0.02,0.01,0.02,0.05,0.02,0.01,0.05,0.11,0.13
27136,다당제가 되지않는 것은 법이나 제도 때문이 아니라 제 3당을 창당하고 이끌어갈 인물이 없기때문이다 새정치에 대한 국민의 열망을 외면하고 민주당과 새정치연합 합당을 한 안철수가 지금와서 다당제를 거론하는 것도 말이 되지않는다,0.67,0.01,0.01,0.02,0.02,0.04,0.01,0.08,0.2,0.09
28034,640 안철수 X파일 대장동 그분 조재연대법관 딸은 안다 via,0.88,0.02,0.02,0.02,0.01,0.02,0.01,0.03,0.04,0.14
28597,안철수 정권 연장의 일등 공신의 길로 들어서다 민주당의 때 늦은 정치 개혁 먼저 심판을 받으라 노 정 단일화의 역풍이 몰려온다 대선 판도가 끝나간다 김영환TV철수야 비단 주머니를 줄테니 너도 단일화 결렬됐다고 말하니 정말로 그런 줄 안다 고 한번 말하고 돌아와라 늦지 않았다,0.73,0.02,0.03,0.01,0.01,0.01,0.01,0.04,0.07,0.27
28988,다시 한번 애기해드릴게요 정권교체는 안철수 후보님만 해당되요 진보 좌파 이재명 후보님 윤석열 후보님김건희 왈 우린 원래 좌파에요 윤석열 후보님 우리 문제인 대통령님 저도 국민인되요 저 명령한적 없어요,0.72,0.01,0.01,0.05,0.01,0.03,0.02,0.07,0.13,0.13
29390,안철수식 정치는 나도 지겹고 넌더리가 나지만 그게 이준석과 윤빠들의 조롱과 막말에 동조할 이유가 되진 않음 정권교체조차 무의미하게 느껴지는 대부분의 이유도 이준석과 윤빠들의 패악질에 있음 선사과후단일화,0.93,0.03,0.02,0.05,0.02,0.02,0.02,0.06,0.05,0.05
30233,4번타자 안철수,0.86,0.02,0.02,0.02,0.01,0.02,0.01,0.04,0.09,0.1
30287,대통령후보자이미지1 이재명 어두운 곳 낮은 곳 뭘 아는 공자2 윤석열 뭘 모르는 노자 3 심상정 칼 솜씨가 예리한 요리사 장자4 안철수 수술 중에 전화받고 나가 버린 의사 맹자,0.62,0.01,0.01,0.02,0.03,0.03,0.01,0.03,0.04,0.33
32075,안철수에게 자기에게 밀어닥치는 엄청난 민중의 기대가 무거운 책임감으로 느껴졌을 뿐이다 이러한 책임감은 결과에 구애되지 않고 의미 있는 정치적 가치를 실현하기 위해 정면으로 부딪치는 맹자적 동기주의에 기반한 책임감이다,0.84,0.04,0.02,0.02,0.01,0.01,0.01,0.08,0.13,0.07
32215,제1거대야당의 당대표란 지위로 소수당 약자를 무차별 조롱하고 모욕을 주는국민의힘 당대표 이준석이 윤석렬이 대통령이 되어 수렴청정을 단독 안철수에 구애한 이재명 책임총리제 띄운다,0.68,0.01,0.01,0.03,0.01,0.01,0.01,0.03,0.06,0.49
33582,자기도 오렌지색 당점퍼를 입던가 하지 혼자만 매번 백색만 입는 북왕조수괴 김정은 같이 저게 뭘까 안철수는 자아에 대한 특별의식이 너무나 강한 것 같다,0.84,0.02,0.02,0.02,0.01,0.02,0.01,0.03,0.1,0.15
33942,우리가 을 모욕했다 캠프서 흘러나온 단일화 자성론 철수를 하든 안하든 이준석 주둥아리는 닥쳐야 한다 정권교체 실패하면 윤석열 안철수 이준석 권영세 등과 제밥그릇 챙기려는 술수쟁이들 윤핵관은 몽땅 정계은퇴해야,0.89,0.03,0.02,0.04,0.01,0.05,0.01,0.04,0.08,0.08
33964,안철수 단일화 겁나서 도망쳤다,0.74,0.02,0.02,0.03,0.04,0.01,0.02,0.19,0.2,0.04
35535,안철수 눈엔 안철수 뿐인 듯요 같이 일하면 동료들 힘들게 하는 타입,0.75,0.05,0.01,0.04,0.01,0.02,0.01,0.02,0.03,0.21
35564,안철수 사람의 자아가 진하게 느껴지는건 처음,0.86,0.03,0.02,0.03,0.01,0.02,0.01,0.04,0.05,0.22
35689,안철수 후보가 한 말입니까,0.88,0.05,0.03,0.02,0.02,0.02,0.01,0.04,0.06,0.07
37409,입만 열면 거짓말 하는 짓마다 도둑질인 4 15부정선거 집단 문재인과 민주당 은 후대들에게 걸어가야 할 길을 제시할 수 없다 그들의 인생 자체가 거짓 인생 도둑 인생이기 때문이다 정권교체 없이는 미래 없다 윤석열 안철수의 조건없는 단일화로 압도적 정권교체하는 건 국민의 뜻,0.6,0.12,0.02,0.01,0.02,0.01,0.01,0.06,0.17,0.06
40553,안철수 이제 저의 길 가겠다 이준석 고인 유지 유세차 들어가기 전 유서 써놓고 가나 다음 뉴스 어머나 단일화 할줄 알았는데 의외,0.66,0.04,0.01,0.01,0.05,0.02,0.0,0.05,0.07,0.2
41273,안철수가 너무해 방미TV 뉴스팩트 출처,0.63,0.02,0.18,0.01,0.02,0.02,0.01,0.21,0.16,0.08
41347,안철수 안철수 안철수 안철수 안철수 힘 내라 힘,0.86,0.01,0.02,0.04,0.01,0.02,0.01,0.06,0.07,0.14
42010,빌 게이츠 코로나 이어 또다른 팬데믹 거의 확실 이거 안철수가 얘기한거잖아찰스 뽑아야 돼,0.66,0.07,0.02,0.01,0.01,0.01,0.01,0.05,0.16,0.06
42041,일단 여조엔 안철수 뽑을 거라 표명은 했지만 지금 상황에선 안 후보 뽑기가 상당히 저어됨 석씨돌림 자댕놈들 이렇게까지 혐오스러울 줄은 상상도 못했음,0.85,0.03,0.02,0.02,0.02,0.02,0.01,0.03,0.1,0.12
42230,4 15부정선거 집단 문재인과 민주당 은 도둑질이 생활화되어 있어서 저 집단을 그대로 두면 후대들 완전 망친다 윤석열 안철수의 조건없는 단일화로 압도적 정권교체하는 건 국민의 뜻 준석아 너 죽고 싶으면 단일화 방해해라,0.71,0.04,0.01,0.02,0.01,0.02,0.01,0.03,0.08,0.2
42911,중대재해법 위반혐의로 조사 받아야 하고 불법적인 버스 개조로 인한 사망사고를 발생케한 혐의로 미필적 고의로 인한 사망 사건에 대한 수사를 받아야 하는데도 선거 유세를 다시 하겠다는 안철수 이 놈은 참으로 뻔뻔하기 짝이 없는 놈이 분명하다,0.6,0.02,0.02,0.02,0.01,0.01,0.01,0.03,0.07,0.55
43371,영남 사람 앞째비 세워서 권력 장악한다기본 전략임노무현문재인안철수PK에서이재명TK로 변경한 것일 뿐임동진론애초부터 다른 지역 분 비영남권 들은생각조차도 안하고 있음윤석열 서울 출신당선되면영남 대권 독식론 이 구도는 깨짐,0.72,0.01,0.02,0.01,0.01,0.01,0.01,0.05,0.14,0.2
43376,안철수 어떤 풍파에도 결코 굴하지 않겠다 완주 시사,0.7,0.02,0.02,0.01,0.01,0.01,0.01,0.04,0.11,0.31
43947,이번 선거에서 투표 할 후보는안철수 대통령 후보밖에 없다,0.77,0.02,0.01,0.04,0.01,0.07,0.02,0.09,0.19,0.04
43966,침통한 표정의 안철수 후보 다음 뉴스,0.87,0.03,0.02,0.04,0.01,0.02,0.01,0.03,0.05,0.17
44012,안철수 고인 뜻 받을어 완주한다 18일 오후부터 선거활동 재개 기호4안철수만루홈런치자 기호4안철수대선승리하자,0.92,0.05,0.02,0.04,0.02,0.02,0.02,0.04,0.04,0.05
44131,안철수는,0.9,0.05,0.02,0.05,0.01,0.02,0.01,0.03,0.04,0.08
44161,김미경교수님의 빠른 쾌유와 건강하신모습으로 복귀하시길 간절히 기도합니다 또한 고인의 명복을 빕니다 유가족들에게 위로의 말을 전합니다 안철수후보님의 더좋은 정권교체 꼭이룰것입니다 힘내시고 더욱 열심히달려주십시요 대한민국의 정치를 공정함 상식이 통하는 시대를 만들어주세요,0.85,0.02,0.02,0.03,0.01,0.01,0.01,0.03,0.06,0.16
45952,안철수 선거운동 전면 중단 천안 내려가 사태 수습,0.85,0.02,0.02,0.04,0.02,0.02,0.01,0.06,0.12,0.05
50875,안철수는 먼저 자신의 사당 해체하고 공당에서 정치해서 정치력 부터 키워라 하긴 공당 사당 개념이 있다면 국민이 만들어 준 40석 공당을 공중분해 시키는 멍청한 짓을 했겠냐마는,0.87,0.02,0.02,0.02,0.01,0.01,0.01,0.04,0.09,0.1
53266,2차 TV토론 2 이재명 안철수 포털 뉴스서비스 아웃링크 의무화 quot 포털 뉴스편집금지법 quot,0.6,0.02,0.01,0.03,0.01,0.01,0.01,0.06,0.18,0.09
54275,안철수 후보가 질문하면 상대방 후보들은 왜이리 조심스러워짐 선생님 앞에 학생들 처럼 답변들이 거의 소심 자기 아는 대장동등만 당당하게 ㅋㅋㅋㅋ,0.76,0.02,0.01,0.03,0.01,0.01,0.01,0.02,0.09,0.21
54798,안철수 카메라 각도 좀 이상한거 아님 혼 드워프 같아 보여,0.74,0.01,0.01,0.03,0.01,0.02,0.01,0.04,0.13,0.16
54959,오늘 토론은 심상정은 국힘당 2중대 안철수는 민주당 2중대 ㅋㅋㅋㅋ,0.8,0.02,0.01,0.04,0.01,0.02,0.01,0.03,0.14,0.18
54969,아 ㅋㅋㅋㅋㅋ 금속노조사무처장 출신 심상정씨 스타트업 안대표 안철수한테 강성노조의 참맛을 보여주러옴ㅋㅋㅋㅋㅋㅋㅋㅋㅋㅋㅋㅋㅋㅋㅋ,0.88,0.02,0.01,0.03,0.01,0.02,0.01,0.03,0.15,0.09
55673,대통령 후보 호감도 안철수 37 윤석열 34 이재명 34 심상정 30,0.78,0.02,0.03,0.02,0.01,0.01,0.01,0.04,0.15,0.14
56356,안철수 인터뷰 돈 때문에 포기하는 일은 없다 국민의당 안철수 대선 후보가 3 9대선에 끝까지 갈 것이다 만약 단일화가 안 돼서 선거에서 패배한다면 그 책임은 큰 정당에 있는 것 이라고 9일 밝혔다,0.8,0.01,0.01,0.03,0.02,0.02,0.01,0.09,0.21,0.09
